{
  "$schema": "http://json-schema.org/draft-07/schema#",
  "$id": "https://forge.dev/schemas/cli.schema-v1.schema.json",
  "title": "cli.schema-v1",
  "description": "Meta-schema for src/data/generated/cli.schema-v1.json — the forge CLI command-tree export contract. forge emits artifacts conforming to this schema; forge-site validates before rendering (FW-16/FW-17). Command order in the 'commands' array IS the rendering order; no separate index field is needed.",
  "type": "object",
  "additionalProperties": false,
  "required": ["schema_version", "forge_sha", "generated_at", "global_options", "commands"],
  "properties": {
    "schema_version": {
      "const": 1,
      "description": "Contract version. New fields are additive/backward-compatible; removed or renamed fields require a new schema_version and a forge-site renderer update before merge."
    },
    "forge_sha": {
      "type": "string",
      "pattern": "^[a-f0-9]{7,40}$",
      "description": "forge commit SHA the export was generated from."
    },
    "generated_at": {
      "type": "string",
      "pattern": "^\\d{4}-\\d{2}-\\d{2}T\\d{2}:\\d{2}:\\d{2}",
      "description": "ISO-8601 timestamp of generation."
    },
    "global_options": {
      "type": "array",
      "description": "Shared option definitions available to every command. A command references the ones it inherits by name in its own inherited_options array, rather than duplicating the full definition.",
      "items": { "$ref": "#/definitions/option" }
    },
    "commands": {
      "type": "array",
      "description": "Flat list of every command node, in rendering order.",
      "items": { "$ref": "#/definitions/command" }
    }
  },
  "definitions": {
    "argument": {
      "type": "object",
      "additionalProperties": false,
      "required": ["name", "description", "required", "variadic"],
      "properties": {
        "name": { "type": "string", "minLength": 1 },
        "description": { "type": "string" },
        "required": { "type": "boolean" },
        "variadic": { "type": "boolean" }
      }
    },
    "option": {
      "type": "object",
      "additionalProperties": false,
      "required": ["name", "aliases", "description", "type", "default", "required", "variadic", "repeatable"],
      "properties": {
        "name": { "type": "string", "minLength": 1 },
        "aliases": { "type": "array", "items": { "type": "string" } },
        "description": { "type": "string" },
        "type": { "type": "string", "enum": ["boolean", "string", "number", "array"] },
        "default": {
          "description": "The option's default value; use null when there is none. Type is unconstrained since it depends on the option's own 'type'."
        },
        "required": { "type": "boolean" },
        "variadic": { "type": "boolean" },
        "repeatable": { "type": "boolean" }
      }
    },
    "example": {
      "type": "object",
      "additionalProperties": false,
      "required": ["description", "command"],
      "properties": {
        "description": { "type": "string", "minLength": 1 },
        "command": { "type": "string", "minLength": 1 }
      }
    },
    "ordering": {
      "type": "object",
      "additionalProperties": false,
      "required": ["arguments", "options"],
      "description": "Explicit rendering-order rule for this command's arguments/options arrays, independent of how the emitter happened to list them.",
      "properties": {
        "arguments": { "type": "string", "enum": ["declaration", "alphabetical"] },
        "options": { "type": "string", "enum": ["declaration", "alphabetical"] }
      }
    },
    "command": {
      "type": "object",
      "additionalProperties": false,
      "required": ["id", "name", "path", "hidden"],
      "description": "A hidden command only needs id/name/path/hidden populated. A non-hidden command must carry every field below (build fails otherwise).",
      "properties": {
        "id": {
          "type": "string",
          "pattern": "^[a-z0-9]+(?:[-.][a-z0-9]+)*$",
          "description": "Stable identifier used as the URL slug. Renaming this without a schema_version bump is a breaking change."
        },
        "name": { "type": "string", "minLength": 1 },
        "path": { "type": "string", "minLength": 1, "description": "Full command path, e.g. 'forge ops check'." },
        "summary": { "type": "string" },
        "description": { "type": "string" },
        "aliases": { "type": "array", "items": { "type": "string" } },
        "arguments": { "type": "array", "items": { "$ref": "#/definitions/argument" } },
        "options": { "type": "array", "items": { "$ref": "#/definitions/option" } },
        "inherited_options": {
          "type": "array",
          "description": "Names referencing entries in the top-level global_options array.",
          "items": { "type": "string" }
        },
        "examples": { "type": "array", "items": { "$ref": "#/definitions/example" } },
        "hidden": { "type": "boolean", "description": "Hidden commands are excluded from rendered docs." },
        "deprecated": {
          "type": ["boolean", "string"],
          "description": "false/absent-equivalent when not deprecated; a string carries the deprecation message rendered as a callout."
        },
        "ordering": { "$ref": "#/definitions/ordering" }
      },
      "allOf": [
        {
          "if": {
            "not": {
              "required": ["hidden"],
              "properties": { "hidden": { "const": true } }
            }
          },
          "then": {
            "required": [
              "id",
              "name",
              "path",
              "summary",
              "description",
              "aliases",
              "arguments",
              "options",
              "inherited_options",
              "examples",
              "hidden",
              "deprecated",
              "ordering"
            ]
          }
        }
      ]
    }
  }
}
